{
  "$schema": "https://flowblind.local/schemas/flowblind-private-hidden-flow-v1-activation-manifest.schema.json",
  "activationClass": "package-local-retained-conformance",
  "advertiseToScientist": false,
  "bridgeExtension": {
    "acceptedBridgeSha256": "f61326fd42415d02d03686dad4bb1d9e5b3098225c5eebf37a2aa4fffc987122",
    "acceptedBridgeSource": "tools/catalogResearchV2/integrations/hiddenFlowV1.ts",
    "behavior": "accept-compact-or-stable-pretty-json-without-reencoding-and-preserve-reconciliation-detail",
    "extensionByteLength": 95226,
    "extensionSha256": "154d29dc5b5a0de67096fcb975fb90e310753af9ab6cb882a76d61d8af42181f",
    "extensionSource": "tools/catalogResearchV2/package/hiddenFlowV1PortableBridge.ts",
    "id": "flowblind-hidden-bridge-stable-json-bytes-v2"
  },
  "enabled": true,
  "exactNativeBytePreservation": "versioned-package-source-extension",
  "id": "flowblind-private-hidden-flow-v1-activation-manifest-v1",
  "liveActivationEligible": false,
  "liveImageManifestDigests": {
    "prepare": "REQUIRED_BEFORE_LIVE_ACTIVATION",
    "run": "REQUIRED_BEFORE_LIVE_ACTIVATION"
  },
  "maximumVerifiedRunBytes": 67108864,
  "retainedPackage": {
    "lockSha256": "07cfa7f06e01cd2274dc10c6798795d47dd37ac3741bef070368eb7bf003833c",
    "runtimeSha256": "6374a888453483304e9d991c5e7b6beb591aa9c64d101b79cf5b97b176db5cbe",
    "verifierSha256": "fa8870b2bea94dcadfc4233202128f3d3b8535e46c133c52c7f3b7ab393fe816"
  },
  "retainedTreeSha256": "e565c7004bc9f81fdfde11da9023481fa4e51f0e288c58b2450d56d17d8d73e3",
  "route": {
    "familyId": "hidden-flow",
    "methodId": "finite-basis-hidden-flow-v1",
    "methodVersion": "1.1.0"
  },
  "runtimeNetworkRequired": false,
  "schemaVersion": 1
}
